{
  "work_package_id": "WP-003",
  "linear_issue": "ENG-155",
  "status": "ready_for_review",
  "identity_and_session": {
    "producer_identity": "OpenAI GPT-5.6 Sol — WP-003 scope-refresh producer",
    "producer_session": "ChatGPT Polar based project / WP-003 Q13-Q14 remediation after independent re-review round 2 / 2026-08-07",
    "reviewer_identity": "UNASSIGNED independent Research Program Architect for round 3",
    "reviewer_session": "MUST DIFFER FROM PRODUCER SESSION",
    "gatekeeper_identity": "UNASSIGNED Senior Adversarial Methodology Reviewer",
    "gatekeeper_session": "MUST DIFFER FROM PRODUCER AND REVIEWER SESSIONS",
    "prior_roles": [
      "Producer of earlier LogicLens strict-epistemic engineering artifacts",
      "Producer/refresher of WP-003 related-work artifacts",
      "Producer of the first B1-B6 WP-003 remediation",
      "Producer of the bounded Q13/Q14 scope refresh requested by independent re-review round 2"
    ],
    "conflict_declaration": "Producer is conflicted from independent novelty acceptance and GATE-001 decisions. GitHub validation PASS is technical producer evidence only.",
    "forbidden_context_attestation": "No future HOLDOUT or REPLICATION content was accessed or used; pilot scores were not used as confirmatory evidence; included and excluded works were dispositioned from primary proceedings/preprint sources rather than search snippets alone."
  },
  "input_hashes_verified": true,
  "input_hashes": {
    "EpistemicCompilerLab/research-execution/WORK_PACKAGES.yaml": "0ce4406a94530a43a23bd62e2500e704d3ec0778cc34108f43920087128d556e",
    "EpistemicCompilerLab/research-execution/schemas/work-package.schema.json": "a68ef6c36da28a374927ca465461ae372afe535eb2ca1c6f7458e366c3733160",
    "EpistemicCompilerLab/research-execution/schemas/work-package-handoff.schema.json": "cafef50ea7faecb3b12353dac7a06c2a02393982ee36480c5b626a208f7e0fee",
    "EpistemicCompilerLab/research-execution/validation/linear-relations-snapshot.json": "4f3943cd5aea669a49650d75c82314830aed7c870bf59ce34cd262d4ef17209c",
    "EpistemicCompilerLab/research-execution/CRITICAL_PATH.md": "f551b3f854a9e3d06ec63be2b2e9f1481a0d50333b9b10ad5bea07f21f79ae54",
    "EpistemicCompilerLab/research-execution/ENG-153_INDEPENDENT_REVIEW_ROUND2_2026-08-06.md": "4358d003f7f2480374bf72c3b59eaeae9873e30542385d5fae7a7ed6d364196b"
  },
  "files_created": [
    "EpistemicCompilerLab/research-execution/context-packets/WP-003/SCREENING_LEDGER_2026-08-07.csv",
    "EpistemicCompilerLab/research-execution/context-packets/WP-003/SATURATION_ROUNDS_2026-08-07.csv",
    "EpistemicCompilerLab/research-execution/context-packets/WP-003/DIMENSION_LEDGER_ALL_2026-08-07.csv",
    "EpistemicCompilerLab/research-execution/context-packets/WP-003/NEAREST_WORK_STRUCTURED_2026-08-07.csv",
    "EpistemicCompilerLab/research-execution/context-packets/WP-003/NEAREST_RANKING_RULE_2026-08-07.md",
    "EpistemicCompilerLab/research-execution/context-packets/WP-003/TRANSFER_LADDER_CONTROLS_2026-08-07.csv",
    "EpistemicCompilerLab/research-execution/context-packets/WP-003/validate_wp003_semantics.py"
  ],
  "files_modified": [
    "EpistemicCompilerLab/research-execution/RELATED_WORK_MATRIX.csv",
    "EpistemicCompilerLab/research-execution/RELATED_WORK_SEARCH_LOG.yaml",
    "EpistemicCompilerLab/research-execution/NOVELTY_BOUNDARY.md",
    "EpistemicCompilerLab/research-execution/context-packets/WP-003/DIMENSION_LEDGER_ALL_2026-08-07.csv",
    "EpistemicCompilerLab/research-execution/context-packets/WP-003/SCREENING_LEDGER_2026-08-07.csv",
    "EpistemicCompilerLab/research-execution/context-packets/WP-003/SATURATION_ROUNDS_2026-08-07.csv",
    "EpistemicCompilerLab/research-execution/context-packets/WP-003/validate_wp003_semantics.py",
    "EpistemicCompilerLab/research-execution/handoffs/WP-003.json"
  ],
  "commands_run": [
    "Primary-source Q13 refresh across arXiv and ACL Anthology for SOP/decision-graph/symbolic-router/tool-schema-adaptation families on 2026-08-07",
    "Primary-source Q14 refresh across ACL Anthology for teacher trajectories, agent distillation, Qwen SFT/RL and reinforcement-distillation families on 2026-08-07",
    "Candidate-level inclusion/exclusion and seven-dimension scoring for Q13/Q14",
    "Temporary GitHub PR #73 clean-run validation on Ubuntu 24.04 / Python 3.12 with pinned PyYAML 6.0.2",
    "GitHub Actions run 31142475331 / job 92755061190: context packet preflight PASS, artifact validator PASS, semantic validator PASS",
    "Temporary validation PR #73 closed without merge after evidence collection"
  ],
  "tests": [
    {
      "name": "context packet preflight",
      "status": "PASS",
      "evidence": "GitHub Actions run 31142475331 job 92755061190; validate_context_packet.py --package WP-003 returned PASS with no findings"
    },
    {
      "name": "artifact-level related-work acceptance",
      "status": "PASS",
      "evidence": "GitHub Actions run 31142475331 job 92755061190; validate_related_work.py returned WP-003 PASS"
    },
    {
      "name": "semantic related-work acceptance after transfer-ladder expansion",
      "status": "PASS",
      "evidence": "GitHub Actions run 31142475331 job 92755061190; semantic contract passed with 58 primary sources, 14 core structured comparisons and 8 mandatory transfer-ladder controls"
    },
    {
      "name": "latest saturation scope",
      "status": "PASS",
      "evidence": "Semantic validator requires Q11/Q12 saturation_usable=no and latest usable Q13/Q14; both Q13/Q14 contain zero sources reaching five strict YES dimensions out of seven"
    },
    {
      "name": "router and schema alternative-explanation coverage",
      "status": "PASS",
      "evidence": "RW-052 SOP-Agent and RW-053 PA-Tool are mandatory transfer controls; decision-graph/SOP routing and schema naming are explicitly removed from novelty claims"
    },
    {
      "name": "weight-adaptation boundary coverage",
      "status": "PASS",
      "evidence": "RW-035 plus RW-054..RW-058 cover Prolog training, agent trajectory distillation, teacher-generated Qwen SFT, reinforcement distillation, AgenticQwen RL and distillation-induced behavioral convergence"
    },
    {
      "name": "novelty wording boundary",
      "status": "PASS",
      "evidence": "NOVELTY_BOUNDARY.md states ENG-200/201/202 are comparator/boundary regimes and retains only the fixed-weight authoritative semantic-result placement candidate claim"
    }
  ],
  "acceptance_checks": [
    {
      "class": "artifact",
      "criterion": "All declared WP-003 artifacts and bounded Q13/Q14 remediation ledgers exist and validate.",
      "status": "PASS",
      "evidence": "Clean GitHub Actions validation passed in run 31142475331"
    },
    {
      "class": "scientific",
      "criterion": "Expanded transfer-ladder prior work is screened, occupied broad claims are removed, and latest saturation evidence post-dates ENG-200/201/202 scope expansion.",
      "status": "PASS",
      "evidence": "58 primary sources; Q13/Q14 latest usable rounds; zero five-of-seven matches; mandatory router/schema/distillation controls frozen"
    },
    {
      "class": "independence",
      "criterion": "A distinct independent reviewer must evaluate this Q13/Q14 remediation and a distinct gatekeeper must decide GATE-001.",
      "status": "BLOCKED",
      "evidence": "Independent re-review round 2 requested this remediation; the current producer implemented it and cannot issue the round-3 acceptance decision"
    },
    {
      "class": "adversarial",
      "criterion": "Decision-graph/SOP/Prolog routing, schema adaptation, executable programs, teacher-generated Qwen adaptation and distillation-induced imitation are treated as occupied mechanisms or alternative explanations.",
      "status": "PASS",
      "evidence": "SOP-Agent, PA-Tool, SmartAD, Skill-Aware, REDI, AgenticQwen, Prolog-tool training and When Agents Look the Same are frozen as transfer-ladder controls"
    },
    {
      "class": "reproducibility",
      "criterion": "A clean reviewer can repeat preflight, artifact validation and semantic validation with candidate-level Q13/Q14 ledgers.",
      "status": "PASS",
      "evidence": "GitHub-hosted Ubuntu 24.04/Python 3.12 executed the complete validation chain successfully in run 31142475331"
    }
  ],
  "known_limitations": [
    "The search is systematic and citation-chained but is not a registered systematic review.",
    "Legacy Q1-Q10 are not reproducible saturation evidence; Q11/Q12 are reproducible but superseded by transfer-ladder scope expansion; Q13/Q14 are the latest usable producer-side rounds.",
    "Search interfaces do not expose stable raw database hit counts; fresh rounds freeze the unique primary candidates actually opened and screened.",
    "Several arXiv works may later receive proceedings versions and require a final pre-submission refresh.",
    "AgenticQwen exact per-model size details are not inferred from the abstract; the control table explicitly leaves exact sizes to primary-paper review rather than inventing values.",
    "No producer-side validator or saturation result establishes novelty acceptance, priority wording or GATE-001 PASS."
  ],
  "protocol_deviations": [],
  "unexpected_findings": [
    "SOP-Agent directly occupies the broad decision-graph/SOP routing mechanism that ENG-200 might otherwise appear to introduce.",
    "PA-Tool makes tool-schema naming a concrete causal alternative: small-model tool-use gains can arise without training or teacher reasoning.",
    "SmartAD, Skill-Aware, REDI and AgenticQwen make the teacher-to-small-model weight-adaptation boundary dense rather than hypothetical.",
    "Distillation-induced tool-use action-graph convergence is measurable and must not be confused with the fixed-weight semantic-placement mechanism.",